楼房名称,价格（套/万元）,单价（元/m2）,地址,房间样式,房间规模（m2）,楼层规模
盛祥苑1楼 带平地车库 三室朝阳 采光佳,120,9449,盛祥苑 ,3室2厅 ,127, 低楼层
黄河花园多层3楼三房 采光佳 无遮挡,80,9303,黄河花园十七地块 ,3室1厅 ,86, 中楼层
阳光花园 大润发商圈 二附 小 可用 满两年 楼层好,90,8257,阳光花园 ,3室2厅 ,109, 中楼层
丹桂苑金鹰商圈 满两年带车库 交通便利实用性强诚售！,140,10295,丹桂苑 ,4室2厅 ,136, 中楼层
金碧湖畔多层2楼 采光充足 无遮挡,138.8,10366,金碧湖畔 ,3室2厅 ,133.9, 低楼层
中天虹桥两房 采光充足 视野宽阔,156.8,16307,中天虹桥花园 ,2室2厅 ,96.16, 高楼层
前进小群采光好视野开阔交通方便。,78,9398,前进小区一区 ,3室2厅 ,83, 低楼层
香缇豪庭2室精装修 位置好 交通便利 配套设施齐全,71,8318,香缇豪庭 ,2室2厅 ,85.36, 中楼层
翔宇大道边  精装修 提包入住  业主诚心出售,103,8620,丰泰东方康桥 ,3室2厅 ,119.5, 高楼层
鼎立香榭丽南区 2室2厅 精装修,80,7452,鼎立香榭丽花苑南区 ,2室2厅 ,107.36, 中楼层
东方花园 3室2厅 140万,140,11667,东方花园 ,3室2厅 ,120, 高楼层
银都商城 精装修三室 高层 楚秀园,120,8334,银都商城 ,3室2厅 ,144, 高楼层
樱花小区 双阳台 采光充足 带轿车库,120,8498,樱花小区 ,3室2厅 ,141.22, 高楼层
丽都花苑精装修，拎包入住，随时看房。,93,8158,丽都花苑 ,3室2厅 ,114, 高楼层
鼎立香榭丽  2室2厅 精装修 拎包入住,75,7247,鼎立香榭丽花苑南区 ,2室2厅 ,103.5, 高楼层
东城江南 联排别墅 大院子 373平毛坯,522,13995,东城江南 ,4室2厅 ,373, 3层  
业主诚心出售，看房方便，看好价格可以适量谈点,78,8769,福晟钱隆城 ,3室2厅 ,88.95, 高楼层
东方凯旋城 3室2厅 精装修 拎包入住,85,7457,东方凯旋城 ,3室2厅 ,114, 低楼层
观景房 樱花小区4层洋房3室 好楼层2楼 有车库 采光好,110,9893,樱花小区 ,3室2厅 ,111.19, 中楼层
亿丰时代广场大三房楼层美丽户型方正,110,8777,亿丰时代广场 ,3室2厅 ,125.33, 低楼层
黄河花园八组团精装修大三房多层公摊少,128,9258,黄河花园8组团 ,3室2厅 ,138.26, 低楼层
万达商圈 文府佳苑 位置好 好楼层 采光无遮挡,85,7399,文府佳苑 ,3室1厅 ,114.89, 中楼层
此房满五唯一 精装  环境优美  交通便利,90,8738,金榜花园 ,3室1厅 ,103, 高楼层
精装修，拎包入住，直视深林公园，隔壁吾悦广场,180,11326,星雨华府(淮安区) ,4室2厅 ,158.93, 中楼层
中南世纪城 经典2房 精装修 满两年,90,10527,中南世纪城 ,2室2厅 ,85.5, 高楼层
东方希尔顿 精装3房老证税少 交通方便,127,9203,东方希尔顿 ,3室2厅 ,138, 高楼层
东方豪城 精装修 3室2厅1卫,75,8674,东方豪城 ,3室2厅 ,86.47, 高楼层
急售  城开御园  东边户！3室2厅一厨2卫,73,6540,城开御园二期 ,3室2厅 ,111.63, 低楼层
天山华庭 两室朝阳 楼层好 采光充足,182,14331,天山华庭 ,3室2厅 ,127, 中楼层
城南精品多层四房，中间楼层，毛坯房,100,7519,中央华府 ,4室2厅 ,133, 中楼层
钱隆御景全新精装修3房前后双阳台,95,8190,力天健康城 ,3室2厅 ,116, 低楼层
交通便利，周 边购物超市，餐饮娱乐多。,86,7414,东湖望景苑 ,3室2厅 ,116, 高楼层
出售淮中旁 富春花园1楼适合老人居中,155,10164,富春花园 ,4室2厅 ,152.5, 低楼层
淮中旁富春花园6楼采光刺眼看房方便,111,8880,富春花园 ,3室2厅 ,125, 高楼层
光辉乾城3室 好楼层采光充足 户型好 位置好交通方便,118,11133,联众光辉乾城 ,3室2厅 ,106, 中楼层
淮州宾馆宿舍标准三方满五唯一懂的来,140,15462,淮州宾馆宿舍 ,3室2厅 ,90.55, 高楼层
清城美墅 5室2厅 295万,295,10279,清城美墅 ,5室2厅 ,287, 4层  
盐河东街6号原糖厂宿舍 装修好三房 盐河边环境好,85,8674,盐河东街6号 ,3室2厅 ,98, 高楼层
金泽花苑精装大三房 南北通透  位置好，拎包入住,88,6822,金泽花苑 ,3室2厅 ,129, 高楼层
书香门第，地理位置好，位于淮中西侧,95,8483,书香门第 ,3室2厅 ,112, 高楼层
户型方正，环境优美，随时可以看房。,78,8574,翠湖一号 ,2室2厅 ,90.98, 低楼层
楚秀园盼旁金伦汇景园边户好楼层精致3房低 总 价急售,116,9598,金伦汇锦园 ,3室2厅 ,120.86, 中楼层
翡翠城 精装四房 老证税少 拎包入住 有车位 库,120,8665,翡翠城花园 ,4室2厅 ,138.5, 中楼层
欣明文锦城 品质小区 环境优美 房东诚心出售,126,9167,文锦城锦苑 ,4室2厅 ,137.45, 高楼层
国贸大厦 精装修三室 新亚商圈,128,12488,国贸大厦 ,3室1厅 ,102.5, 高楼层
天和豪庭小区中间，两房朝南，采光无遮挡，看房方便。,70,7744,天和豪庭 ,2室2厅 ,90.4, 中楼层
金辉天鹅湾 精装三房 大润发商圈 盐河边 环境优美,90,9783,金辉天鹅湾 ,3室2厅 ,92, 低楼层
樱花小区3室 有车库 采光充足 交通便利 位置好,120,9375,樱花小区 ,3室2厅 ,128, 高楼层
瑞祥花苑 3室2厅 116万,116,10176,瑞祥花苑 ,3室2厅 ,114, 低楼层
上下复式 中式装修 带地暖 全红木家具 大品牌家电,198,9470,世纪佳苑 ,5室2厅 ,209.1, 高楼层
黄河花园采光好视野开阔交通方便,84.8,9529,黄河花园七组团 ,3室2厅 ,89, 低楼层
新天地荣府精装修三房采光充足视野开阔,120,11617,新天地荣府 ,3室1厅 ,103.3, 高楼层
国联.南惠佳园 3室2厅 65万,65,5556,国联.南惠佳园 ,3室2厅 ,117, 低楼层
清中宿舍 2室2厅 128.8万,128.8,18400,清中宿舍 ,2室2厅 ,70, 低楼层
樱花小区2室 有车库 税点低 采光充足 交通方便,82,9112,樱花小区 ,2室2厅 ,90, 高楼层
老证，楼层采光好视野开阔，采光好，随时看,121.5,7994,淮上人家 ,4室2厅 ,152, 高楼层
房东诚心卖 精致三房 采光全天无遮挡 业主急售,118,8873,樱花小区 ,3室2厅 ,133, 中楼层
怡景园小区，配套成熟，两房精装，拧包即住。,75,8065,怡景园 ,2室2厅 ,93, 中楼层
市级机关北院生活区精装修电梯两房,180,18368,市级机关北院生活区 ,2室2厅 ,98, 中楼层
永辉超市 南丹桂苑大户型采光充足视野开阔,141,10315,丹桂苑 ,6室2厅 ,136.7, 高楼层
叶语香澜独栋别墅 4层6室毛坯房 有院子 环境优美,358,10849,叶语香澜 ,6室3厅 ,330, 1层  
鼎立香榭丽 一二叠加 有院子 毛坯随意装,202,10386,鼎立香榭丽花苑 ,5室2厅 ,194.5, 低楼层
四季金辉 3室2厅 116万,116,9667,四季金辉 ,3室2厅 ,120, 低楼层
房主诚心出售。满五唯一。采光充足。拎包入住,93,8962,金碧湖畔 ,2室1厅 ,103.78, 中楼层
精装修三房 采光无遮挡 满五年唯一 拎包入住 急售,128,9553,国华御锦园 ,3室2厅 ,134, 高楼层
水韵天成银杏院一楼 硬装已做好 方形方正,260,14690,水韵天成银杏苑 ,4室2厅 ,177, 低楼层
香格里拉B区 4室2厅 168万,168,11901,香格里拉B区 ,4室2厅 ,141.17, 中楼层
黄河花园2室精装修 有车库 位置好 交通便利 采光好,74,9250,黄河花园十七地块 ,2室2厅 ,80, 高楼层
东城一品 3室1厅 73万,73,7526,东城一品 ,3室1厅 ,97, 高楼层
黄元小区4室 好楼层3楼 有车库 采光充足 交通方便,86,6826,黄元社区 ,4室2厅 ,126, 中楼层
御景城，老证，精装修，拎包即住，采光好，地段好,125,10050,御景城 ,3室2厅 ,124.39, 高楼层
恒大名都一期精装修 满2年 环境优雅 价格美丽,115,7372,淮安恒大名都 ,4室2厅 ,156, 低楼层
简单装修，拎包即住，出行便利，周 边配套设施齐全,94,7834,翔宇花园 ,3室2厅 ,120, 高楼层
海棠广场 淮 外学--位房子 毛坯三房,126,11105,翔宇海棠广场 ,3室1厅 ,113.47, 低楼层
深圳路，紫荆苑，多层3楼，装修好的,85,8253,紫荆苑 ,2室2厅 ,103, 中楼层
帝景豪庭 淮阴区大润发旁 交通便利 配套齐全,80,12308,世邦帝景豪庭 ,3室2厅 ,65, 低楼层
世纪苑 北京东路利群商圈 交通便利 生活方便,106,11778,世纪苑 ,2室2厅 ,90, 中楼层
品质小区，电梯洋房顶楼带阁楼，精装，满两年，有车库,125,13327,学府名门 ,3室2厅 ,93.8, 高楼层
迎宾花园小区4楼 两室朝阳 带车库,70,8772,迎宾花园小区 ,2室1厅 ,79.8, 中楼层
"：
此房满2年，南北通格局，采光充足，配套完善",145,10172,御东学府 ,3室3厅 ,142.55, 高楼层
锦绣山阳 精装3房 老证税少 拎包入住 精装超大阁楼,132.8,9035,锦绣山阳 ,3室2厅 ,147, 高楼层
此房楼层好，视野开阔，采光刺眼，配套齐,95,10440,盛世名门 ,2室1厅 ,91, 高楼层
万达广场一期住宅  小区生活方便   交通便利,130,9864,万达广场一期住宅 ,3室2厅 ,131.8, 低楼层
书院名居 毛坯三房 楼层好 采光佳,83,7762,书院名居 ,3室2厅 ,106.94, 低楼层
淮托宿舍   好楼层   采光无限   方型方正,93.5,12467,淮拖宿舍 ,3室1厅 ,75, 中楼层
金地商圈 丽都花苑大三房 好楼层 采光好,80,7828,丽都花苑 ,3室2厅 ,102.2, 中楼层
通胜花园 小营转盘旁 交通便利 配套齐全 生活便利,105,9342,通胜花园 ,3室2厅 ,112.4, 中楼层
瑞元经典  精装修三房   采光好 无遮挡,118,8940,瑞元经典 ,3室2厅 ,132, 中楼层
电信北院精装修多层 实用面积大 采光好,185,17755,电信北院 ,4室2厅 ,104.2, 中楼层
金地广场  阳光广场楼层好，采光充足，设施全,125,9382,阳光广场 ,3室2厅 ,133.24, 低楼层
中交香槟国际，四室两厅一厨两卫毛坯房，诚心出售，,118.8,8367,中交香槟国际 ,4室2厅 ,142, 高楼层
樱花小区精装修多层大面积加轿车库,120,9449,樱花小区 ,3室2厅 ,127, 高楼层
多瑙河小区，采光好视野开阔交通方便,90,8572,多瑙河国际公寓 ,4室2厅 ,105, 高楼层
华谊星河  地理位置优越 设施配套齐全 拎包入住,92.8,10346,華誼星河 ,2室2厅 ,89.7, 低楼层
书香门第 4室3厅 65万,65,9028,书香门第 ,4室3厅 ,72, 高楼层
永兴上御 正规小区全明双南采光好房型佳得房率高,78,5987,永兴上御 ,3室2厅 ,130.3, 高楼层
涟洲花园 品质小区 精装3室 紧靠公园 大润发 生活便利,75,6466,涟洲花园 ,3室2厅 ,116, 高楼层
府前御景园   成熟小区  靠 大润发   五岛公园,70,6667,府前御景园 ,3室2厅 ,105, 高楼层
涟洲花园 精装3室 通 透户型 有独立产权的门面车库,110,8245,涟洲花园 ,3室2厅 ,133.42, 中楼层
中央城 3室2厅 77.5万,77.5,7340,中央城 ,3室2厅 ,105.6, 高楼层
清华苑  精装2室  满五唯一 有车库  可念书,58,6905,清华苑(涟水县) ,2室2厅 ,84, 高楼层
金城  名  门   简单装修   房主急售   看房提前联系,62,4770,金城名门 ,3室2厅 ,130, 高楼层
涟洲花园 楼层好 位置佳 主卧客厅朝南 有汽车库,85,8033,涟洲花园 ,2室2厅 ,105.82, 中楼层
一楼精装三房，家具家电齐全，拎包入住，户型通风好，,65,6843,南浦佳园 ,3室2厅 ,95, 低楼层
金色华府  品 质楼盘  高 端社区  紧 邻广场 看房方便,75,6207,金色华府 ,3室2厅 ,120.85, 低楼层
桃园小区 多层二楼 134平方四房 简装有车库全款交付,69,5123,桃园小区 ,4室2厅 ,134.7, 中楼层
涟洲花园  品质小区  繁华地段   交通便利,69.6,6534,府前御景园 ,3室2厅 ,106.52, 高楼层
涟洲花园   精装3室   有阁楼  有阳光房,78,6407,涟洲花园 ,3室2厅 ,121.76, 高楼层
府前御景园 品 质楼盘 高 端社区 紧 邻广场  有车库,68,6072,府前御景园 ,3室2厅 ,112, 高楼层
清华苑   精装修   飞机户型 满 五唯一   有小车库,73,6277,清华苑(涟水县) ,3室2厅 ,116.31, 高楼层
永和家园婚装未入住家电家具齐全 有车库,85,7871,永和家园 ,3室2厅 ,108, 高楼层
黄河花园十七地块  采光充足 无遮挡,78,8864,黄河花园十七地块 ,3室1厅 ,88, 高楼层
东昇花园两室朝阳 采光充足 无遮挡,73,9734,东昇花园(北京东路) ,2室2厅 ,75, 中楼层
中恒国际 精装修 有公共车库 基本未住 业主诚心出售,79.8,5877,中恒国际新城D区 ,3室2厅 ,135.8, 中楼层
幸福家园  精装3房   带大平台  有车库 靠 安东学 校,75,6199,幸福家园(涟水县) ,3室2厅 ,121, 低楼层
房子户型方正，生活设施齐全，看房方便,148,15258,富淮小区 ,3室2厅 ,97, 高楼层
宙辉国际精装修两房，房主诚心出售。,96,10106,宙辉国际花园 ,2室2厅 ,95, 中楼层
户型方正 满五唯一 两房客厅朝南 即买即住 采光佳,80,7201,状元府 ,3室2厅 ,111.1, 中楼层
售品质楼盘 设施齐全 满五唯一  业主急,68.8,7167,万香国际 ,2室2厅 ,96, 低楼层
现代名流  精装修  婚房  基本未住  有阁楼 业主急售,63.5,5880,现代名流花苑 ,3室2厅 ,108, 高楼层
府前御景园  紧靠红日 广场 看房方便  业主急售,66,6452,府前御景园 ,3室2厅 ,102.3, 高楼层
东大院后院此房满五唯一，实际建筑面积多，交通便利,150,19355,东大院后院 ,4室1厅 ,77.5, 低楼层
中鑫上城3室 户型好 采光充足 交通方便 位置好,110,9426,中鑫上城 ,3室2厅 ,116.7, 中楼层
金泰大楼小区 3室2厅 198万,198,17161,金泰大楼小区 ,3室2厅 ,115.38, 中楼层
此房满五   客厅加两卧室朝阳  户型方正  高楼层,75,6250,帝景蓝湾(涟水县) ,3室2厅 ,120, 高楼层
户型方正，环境优美，随时可以看房。,240,11539,白鹭湖庄园熙园 ,4室3厅 ,208, 低楼层
满二年 电梯房半装修 大三房 格局开阔,116,9431,融侨·华府 ,3室2厅 ,123, 高楼层
此房 急售 满五唯一 底楼层  汽车库可另售,78,7429,府前御景园 ,3室2厅 ,105, 中楼层
金泽源  紧靠装饰城  温馨两室   有汽车库另售,51,5710,金泽源 ,2室2厅 ,89.33, 低楼层
清华苑  好楼层  视野开阔  采光无遮挡,82,7962,清华苑(淮安区) ,3室2厅 ,103, 低楼层
此房满五唯一  底楼层 有车库 另售汽车库,89,6593,银杏花园 ,3室2厅 ,135, 低楼层
急卖  品质楼盘  多层带阁楼  有车库,68,6194,壹城新莲 ,3室2厅 ,109.8, 高楼层
环城西路46号 2室2厅 166万,166,18682,环城西路46号 ,2室2厅 ,88.86, 中楼层
盛世豪庭 成熟小区 老证 精装修 近万达 出行便利！,105,8975,盛世豪庭(楚州区) ,4室2厅 ,117, 低楼层
金城名 门 满五唯一 精装修 家具家电齐全 拎包入住,76,5758,金城名门 ,3室2厅 ,132, 低楼层
状元府     户型方正 采光充足   有9平车库,65,6715,状元府 ,3室1厅 ,96.8, 高楼层
交通便利，周 边购物超市，餐饮娱乐多。,105,7452,金华尚东国际 ,3室2厅 ,140.92, 高楼层
樱花小区  采光充足 视野开阔 无遮挡,116,9831,樱花小区 ,3室2厅 ,118, 高楼层
樱花小区3室 采光充足 有车库 交通方便 户型好,89.8,9008,樱花小区 ,3室2厅 ,99.7, 高楼层
开发区淮安碧桂园 精装四房 带车位 阳台已封好,160,10959,淮安碧桂园 ,4室2厅 ,146, 中楼层
金色华府 精装4房  产证齐全  大润发商圈 紧 邻菜场,85,5863,金色华府 ,4室2厅 ,145, 中楼层
府升小区多层六楼带车库的房子出售,86,8687,府升小区 ,3室2厅 ,99, 高楼层
黄河花园3室 好楼层 采光充足 交通方便 户型好,81,9011,黄河花园十七地块 ,3室2厅 ,89.9, 中楼层
交通便利，周 边购物超市，餐饮娱乐多。,110,8944,东城景苑 ,3室2厅 ,123, 中楼层
书香名苑3室 户型好 采光充足  有车库 交通方便,93,8455,书香名苑 ,3室2厅 ,110, 低楼层
盛世豪庭，房东诚心想卖，看房提前预约,123,10000,盛世豪庭(楚州区) ,3室2厅 ,123, 中楼层
水沐清华多层小区安静舒适值得拥有,73,7679,水沐清华 ,2室2厅 ,95.07, 高楼层
锦绣前城 电梯房  精装3室  卧室朝南  紧靠大润发,88,6875,锦绣前城 ,3室2厅 ,128, 低楼层
锦绣前城   豪 华装修  品牌家具家电   拎包入住,110,7921,锦绣前城 ,3室2厅 ,138.88, 高楼层
人才小区   满五唯一   有车库  有阁楼 可念书,75,5770,涟水县人才小区 ,4室2厅 ,130, 高楼层
精装修三房 中间楼层 采光无遮挡 业主诚心出售,140,14142,金佳园 ,3室2厅 ,99, 中楼层
人才小区  满五唯一  有车库  可念书 业主诚心出售,70,7143,涟水县人才小区 ,3室2厅 ,98, 高楼层
泽惠园 产证齐全无贷款 满五唯一 有车库 业主诚心出售,65,6047,泽惠园小区 ,3室2厅 ,107.5, 中楼层
学府名苑 户型方正 精装修 家具家电齐全交通便利,78,5736,学府茗苑 ,3室2厅 ,136, 高楼层
凯旋国际 3室2厅 74万,74,6738,凯旋国际 ,3室2厅 ,109.83, 中楼层
学士苑  满五唯一   有车库   可念书  业主诚心出售,70,6586,学士苑 ,3室2厅 ,106.3, 高楼层
学士苑  满五唯一 有车库户型通透  周  边设施齐全,65,6443,学士苑 ,3室2厅 ,100.9, 高楼层
此房满两年  底楼层 小三房 随意装修,66,6408,城市花园(涟水县) ,3室2厅 ,103, 低楼层
幸福家园(涟水县) 3室2厅 78万,78,6532,幸福家园(涟水县) ,3室2厅 ,119.42, 低楼层
幸福家园(涟水县) 4室2厅 83万,83,6748,幸福家园(涟水县) ,4室2厅 ,123, 中楼层
房子户型方正，采光好朝南的户型，,230,13262,红豆美墅 ,4室2厅 ,173.43, 5层  
仁和府  邸  精装婚房  基本未住 有阁楼 紧靠五岛湖,59.8,6608,仁和福邸 ,2室2厅 ,90.5, 高楼层
阳光花园2室 有车库 采光充足 交通方便 户型好,62,8498,阳光花园 ,2室2厅 ,72.96, 高楼层
莱茵风情   精装小3室  电梯房    采光无遮挡,58,6481,莱茵风情 ,3室2厅 ,89.5, 低楼层
丰泰东方康桥三房精装，房东急卖。。。。,118,9807,丰泰东方康桥 ,3室2厅 ,120.33, 低楼层
丽晶首府 3室2厅 120万,120,8555,丽晶首府 ,3室2厅 ,140.27, 中楼层
楼层好，采光好，业主诚心出售。,139,14632,金域华府 ,2室2厅 ,95, 中楼层
此房满五唯一  大户型  三面朝阳  全明户型,90,5770,丽景豪庭 ,3室1厅 ,156, 高楼层
急卖 急卖 急卖 急卖 满五  高楼层,56.8,5856,城市花园(涟水县) ,3室1厅 ,97, 中楼层
锦绣山阳 精装三房 电梯好楼层 老证 随时看,98,9608,锦绣山阳 ,3室2厅 ,102, 中楼层
领秀花都   精装修   品质小区  有车库  有安保,83,7493,领秀花都 ,4室2厅 ,110.78, 高楼层
丽景豪庭  成熟小区  精装3室  紧靠五岛公园,67,6381,丽景豪庭 ,3室2厅 ,105, 低楼层
丽景豪庭   紧靠五岛公园   有汽车库   采光无遮挡,69.8,7271,丽景豪庭 ,2室2厅 ,96, 中楼层
郁金蓝湾 低于市场价急卖 精装修 上天津路 转大公园,120,9918,郁金蓝湾 ,3室2厅 ,121, 高楼层
炎黄嘉园  6楼带阁楼  紧靠车站  交通便利,58,6414,炎黄嘉园 ,3室2厅 ,90.44, 高楼层
状元府  满五唯一   税费低  有10几平车库  业主急售,83,6964,状元府 ,3室2厅 ,119.2, 高楼层
大润发商圈 精装修 拎包入住 采光充足 业主急售,81.8,9991,金润城 ,2室2厅 ,81.88, 低楼层
楼层好，采光好，业主 心态好，诚心出售,185,13256,水韵天成银杏苑 ,3室2厅 ,139.56, 中楼层
急售  急售   电梯房  精装修,74,6202,丽景豪庭 ,3室2厅 ,119.32, 高楼层
卢浮公馆洋房 品牌家居 拎包即住,250,17980,卢浮公馆 ,3室2厅 ,139.05, 中楼层
银杏花园  大面积 有车库有阁楼有平台 可念书 靠医院,60,5218,银杏花园 ,2室2厅 ,115, 高楼层
中恒国际b区 精装2 室有阁楼 有车库 业主诚心卖房,52,5930,中恒国际新城B区 ,2室2厅 ,87.7, 高楼层
好房源，精装修房，可以自由装修，配套齐全,160,11679,梧桐苑 ,3室2厅 ,137, 中楼层
万香国际 采光通透户型 有10几平车库 楼层佳 采光好,91,6333,万香国际 ,3室2厅 ,143.7, 中楼层
润通花园  电梯房  两房朝阳  精装修   随时看房,67,5898,润通花园 ,3室2厅 ,113.6, 低楼层
前进小区3室 有车库 位置好 交通方便 配套设施齐全,80,8566,前进小区一区 ,3室2厅 ,93.4, 高楼层
文雅居  位于政法路  紧靠大润发   生活便利,65,5159,文雅居 ,3室2厅 ,126, 高楼层
淮中旁浦东花园位置很好4室2厅2卫,150,9147,浦东花园 ,4室2厅 ,164, 高楼层
大润发商圈 楼层好 位置佳 东边户简装毛坯价,63.9,6145,中央城 ,3室2厅 ,104, 高楼层
东方红府 电梯房精装二室 拧包就住,71,7889,东方红府 ,2室2厅 ,90, 低楼层
东方花园  3室2厅1卫  紧靠装饰城   交通便利,62,5637,东方花园 ,3室2厅 ,110, 高楼层
东方花园  成熟小区  精装3室   有车库,42,6000,东方花园 ,3室2厅 ,70, 高楼层
天山华庭 精致三房 满两年 精装修  户型好通透格局,160,12513,天山华庭 ,3室2厅 ,127.87, 高楼层
莱茵风情 品 质楼盘 高 端社区紧 邻广场 业主诚心出售,85,7658,莱茵风情 ,3室2厅 ,111, 中楼层
中南世纪城，精装修，满两年，小两房，家具家电全留！,89.9,11676,中南世纪城 ,2室2厅 ,77, 高楼层
毛坯3房，户型方正，视野宽阔，采光充足,145,12362,翔宇海棠广场 ,3室2厅 ,117.3, 高楼层
万香国际 精装2室    基本未住 有两个汽车库   加阁楼,68.8,7646,万香国际 ,2室2厅 ,89.99, 高楼层
绿地四期 精装两房 东边户 采光好 拎包入住,145,16047,绿地世纪城四期 ,2室2厅 ,90.36, 高楼层
红豆美墅联排中户 品牌家居 拎包即住,350,17500,红豆美墅 ,5室3厅 ,200, 3层  
房东诚心出售，此房位置好，采光充足,100,8265,欧洲城(清江浦区) ,3室2厅 ,121, 中楼层
小区环境好，交通方便，有房出售，，，,99,7782,依云法国小城 ,3室2厅 ,127.23, 高楼层
满五年  配套齐全  得房率高 楼间距大  采光无限,72.8,5600,圣特小区 ,3室2厅 ,130, 中楼层
恒大一期满五年精装修中间楼层家具家电全留,105,8481,淮安恒大名都 ,3室2厅 ,123.81, 中楼层
淮上人家 简单装修 繁华地段 有车库,83,8784,淮上人家 ,2室2厅 ,94.49, 中楼层
楚州大道  精装修三房  出门小火车  电梯好楼层,118,10565,锦绣山阳 ,3室2厅 ,111.7, 中楼层
水沐清华多层小区房型端正环境优美得房率高,82,8489,水沐清华 ,3室2厅 ,96.6, 低楼层
新天地荣府3室 毛坯房 户型好 楼层好 采光充足,137,9991,新天地荣府 ,3室2厅 ,137.13, 高楼层
毛坯两房户型方正房东急售看房方便有钥匙,68,7728,永业梦乐城 ,2室2厅 ,88, 低楼层
满五年，精装修。小区北门有菜场，交通便利,95,9179,宙辉国际花园 ,2室2厅 ,103.5, 低楼层
房型方正，双南房间，看中价格可议,90,8654,翔宇花园 ,3室2厅 ,104, 高楼层
房东急卖  满两年  底楼层  随意装修,62.8,6321,湖滨花苑 ,3室2厅 ,99.36, 低楼层
"此房满五, 有车位房间朝南, 采光充足视野开阔",75,7685,翔宇花园 ,4室2厅 ,97.6, 高楼层
都市花园 中间楼层 精装三房 全明户型 拎包即住,90,6894,都市花园D区 ,3室2厅 ,130.56, 高楼层
圣特小区  成熟小区   大3室   多层得房率高,64.8,5758,圣特小区 ,3室2厅 ,112.55, 中楼层
金地国际花园 3室2厅 92.8万,92.8,8249,金地国际花园 ,3室2厅 ,112.5, 低楼层
濠城状元府 精装两房 好位置  老证随时看,82.8,9410,濠城状元府 ,2室2厅 ,88, 中楼层
东城一品 3室2厅 99万,99,7467,东城一品 ,3室2厅 ,132.6, 低楼层
润通花园 多层中装温馨二室 紧红日主题广场 有车库,58,6253,润通花园 ,2室2厅 ,92.76, 中楼层
幸福城 3室2厅 126万,126,11053,幸福城 ,3室2厅 ,114, 中楼层
此房满五唯一  有车库 有阁楼  品质小区,57.8,6149,状元府 ,3室2厅 ,94, 高楼层
文苑小区 3室2厅 228万,228,17582,文苑小区 ,3室2厅 ,129.68, 高楼层
康城明珠 采光充足 无遮挡 视野开阔,135,10976,康城明珠北区 ,3室2厅 ,123, 高楼层
福晟钱隆城四房，前排无遮挡，在家就能看体育馆,100,7948,福晟钱隆城 ,4室2厅 ,125.83, 高楼层
兰亭绿城两室毛坯一楼养老房............,60,6897,兰亭绿城 ,2室2厅 ,87, 低楼层
绿洲花苑 3室2厅 78万,78,7124,绿洲花苑 ,3室2厅 ,109.5, 低楼层
府前御景园 精装四室带大平台 地段繁华,98,6902,府前御景园 ,4室2厅 ,142, 低楼层
水岸名宅6楼带外置阁楼 采光充足 无遮挡,105,10505,水岸名宅 ,3室2厅 ,99.96, 高楼层
锦阳花园2室 精装修 有车库 采光充足 交通便利,50,7724,锦阳花园 ,2室2厅 ,64.74, 高楼层
采光好，套型好，没有浪费面积，公摊面积少。,94,7938,豪景华庭 ,3室2厅 ,118.43, 中楼层
黄河花园十六地块   采光充足 无遮挡,110,7682,黄河花园十六地块 ,3室2厅 ,143.2, 高楼层
银河湾花园采光充足 无遮挡 视野宽阔,129.8,9141,银河湾花园 ,3室2厅 ,142, 中楼层
房子满两年，采光好，公摊小，自住，看房提前联系,120,16439,东大商汇 ,2室2厅 ,73, 高楼层
钱隆御景中间楼层双阳台毛坯三房,85,7328,力天健康城 ,3室2厅 ,116, 中楼层
此房户型方正，中间户，满两年，看房方便,78.8,9203,中南世纪城 ,2室2厅 ,85.63, 低楼层
中南世纪城，大三房，典型边户，带有八角阳台！,126,10371,中南世纪城 ,3室2厅 ,121.5, 中楼层
底楼层  房东急卖  环境优美 设施齐全 满五,69,6572,金轮世家 ,3室2厅 ,105, 低楼层
万香国际 三室两厅 满五唯 一 有大小车库,76,7600,万香国际 ,3室2厅 ,100, 高楼层
如意里 精装3房老证税少 拎包入住,112,8801,如意里 ,3室2厅 ,127.26, 中楼层
房子满五年了老证，精装修 ，看房方便，有车库！,95.8,7624,丰泰东方康桥 ,3室2厅 ,125.66, 中楼层
